Column Name,Content
Preparation Masterproject Software Engineering,"Course catalogue number 5364PRMS6Y Credits 6 EC Language of instruction English Entry requirements For part-time (2 year students): all other courses in the program have been passed. For full-time (1 year students): To continue with the Master’s project preparation in the second semester (January), all courses of the first semester have to be passed. Time period(s)  College/graduate Graduate School of Informatics Lecturer(s) Is part of The objective of the course is teaching the skills needed to successfully complete the Master’s (graduation) project. In summary these skills are: During paper sessions you learn skills to find, read and assess relevant scientific publications. You will also learn to build argumentation structures you need for your theory and analysis. For your graduation you can choose from a number of defined themes. In exceptional cases it is possible to define a project yourself. A tutor will help you during the preparation. You will also discuss your ideas with other students. This is a mixed theoretical and practical course. The format is aimed at exercising skills needed to complete the Master’s project. There are interactive sessions where scientific reading, writing, research design, and presentation skills are covered. Study materials are made available through the course’s BlackBoard page. The student can pass the course by getting approval by a lecturer (tutor) for two deliverables: Course catalogue number 5364PRMS6Y Credits 6 EC Language of instruction English Entry requirements For part-time (2 year students): all other courses in the program have been passed. For full-time (1 year students): To continue with the Master’s project preparation in the second semester (January), all courses of the first semester have to be passed. Time period(s) Sem. 1Sem. 2 Sem. 1 Sem. 2   Sem. 1 Sem. 2   College/graduate Graduate School of Informatics Lecturer(s) dr. M. Bruntinkdrs. H.L. Dekkersprof. dr. D.J.N. van Eijckdr. T. van der Stormdr. S.F.M van Vlijmendr. V.V. Zaytsev (co-ordinator) Is part of Master's Software Engineering Add course to planner Sem. 1 Sem. 2   Registration   is required viahttps://www.sis.uva.nlbefore the start of the semester.   Please visit the website of your programme throughhttp://student.uva.nland   check the A-Z list ’Course and Exam Registration’ for more information. dr. M. Bruntink drs. H.L. Dekkers prof. dr. D.J.N. van Eijck dr. T. van der Storm dr. S.F.M van Vlijmen dr. V.V. Zaytsev (co-ordinator) Master's Software Engineering Problem analysis, Scientific literature survey, Theory building, Hypothesizing, Structuring research and validation, Project planning, Scientific reporting. An interest in reading and writing scientific literature. Affinity with reading and writing English text. Knowledge of current challenges and results in software engineering. Plan for the Masters project, Survey of related literature."
Software Process,"Course catalogue number 5364SOPR6Y Credits 6 EC Language of instruction English Time period(s)  College/graduate Graduate School of Informatics Lecturer(s) Is part of During this course you will come to understand why big software engineering projects are prone to failure. You will come to understand how performance is influenced at different levels: that of the individual software engineer, the team and the whole organization. You will learn about motivation, competences, and the crucial role of culture. Also you will learn about organizational paradigms and control mechanisms, quality paradigms, and the role of planning and design in a world that is volatile and of which a lot is unknown. As software engineering is a special kind of organization, you will also learn how effective our best practices are. With this knowledge you will be able to understand why a method like RUP or Scrum is sometimes successful and sometimes not. You will also come to assess such a method and better be able to use it in such a way to improve overall project performance. Developing large scale software systems is challenging for many reasons. We work from a set of requirements that are ambiguous and incomplete, may be invalid and are subject to change. It’s hard to determine the quality and doneness of (intermediate) deliverables like designs, plans and code. We have to coordinate up to 1.000 software engineers with imperfect mechanisms for separation of concerns. To be able to understand reasons for software project failure we study failed projects. We learn about organizational control mechanisms and look at theory from social sciences notably motivation, empowerment, effective teams and coordination strategies. Last but not least we look at what we can learn from the quality community: Lean, CMMi, TQM, Kaizen. We will also examine evidence about the practices we apply in software engineering, like test first, pair programming, software architecture. Knowledge of software methods like Rup, Scrum, Xp and software practices like pair programming, test first. Experience with working in big projects. Lecture, work groups, seminar. Andy Oram, Greg Wilson'Making Software:What Really Works, and Why We Believe It'. Reading tests, essay and lab work. Course catalogue number 5364SOPR6Y Credits 6 EC Language of instruction English Time period(s) Sem. 1Sem. 2 Sem. 1 Sem. 2   Sem. 1 Sem. 2   College/graduate Graduate School of Informatics Lecturer(s) drs. H.L. Dekkers (co-ordinator) Is part of Master's Software Engineering Add course to planner Sem. 1 Sem. 2   Registration is   required viahttps://www.sis.uva.nlbefore the start of the semester. Please   visit the website of your programme throughhttp://student.uva.nland check   the A-Z list ’Course and Exam Registration’ for more information. drs. H.L. Dekkers (co-ordinator) Master's Software Engineering"
Software Construction,"Course catalogue number 5364SOCO6Y Credits 6 EC Language of instruction English Time period(s)  See also College/graduate Graduate School of Informatics Lecturer(s) Is part of The course focuses on methods and techniques of software construction. This primarily covers the programming and implementation activities of a software engineering project. Examples of such activities are coding and debugging, detailed design, unit testing, code reviews, optimization, component integration and code generation. The course has two main objectivea: In the practical course students will implement a Domain-Specific Language (DSL). This involves both language engineering aspects (parsing, type checking, interpretation etc.) as well as a substantial amount of programming and discussion. The code will be reviewed based on aspects of code quality, simplicity, readability, modularity, separation of concerns and consistency of style. Lectures will provide the required background on DSLs, model-driven engineering (MDE), compiler theory, generative programming, code quality, ""Don't-Repeat-Yourself"" (DRY), code smells and design patterns. Additional academic literature covers subjects such as design-by-contract, SOLID principles, data abstraction, modularity, hierarchy, programming style, code smells, and object-oriented frameworks. Students are required to complete an exam based on the academic literature, to show they master concepts and practices relevant for high quality software construction. Technical mastery of one or more programming languages (e.g., Java, C#, etc.). Lectures, workshops and computer lab. Required reading: Crista Lopes', 'Exercises in Programming Styles'. Syllabus of landmark papers on topics in software construction. 60 Assessment is based on the code produced during the lab and a final exam. Both need to be completed successfully. Final grade is the average of both lab and exam grades. This is a Bring-Your-Own-Device (BYOD) course, so a laptop is required. See here more info: http://student.uva.nl/se/az/item/bring-your-own-device.html Course catalogue number 5364SOCO6Y Credits 6 EC Language of instruction English Time period(s) Sem. 1Sem. 2See also Sem. 1 Sem. 2   Sem. 1 Sem. 2   College/graduate Graduate School of Informatics Lecturer(s) dr. T. van der Storm (co-ordinator)dr. J.J. Vinju Is part of Master's Software Engineering Add course to planner Sem. 1 Sem. 2   Registration is   required viahttps://www.sis.uva.nlbefore the start of the semester. Please   visit the website of your programme throughhttp://student.uva.nland check   the A-Z list ’Course and Exam Registration’ for more information. dr. T. van der Storm (co-ordinator) dr. J.J. Vinju Master's Software Engineering Inform students about the area of software language engineering: how to employ model-driven and language-driven approaches in software construction. This is includes basic theory of compiler construction. Actively engage students to reason about and reflect upon aspect of design, code quality, and software construction methods."
Masterproject Software Engineering,"Course catalogue number 5364MAS18Y Credits 18 EC Language of instruction English Entry requirements For part-time (2 year) students: all other courses in the program have been passed, and the course Preparation Masterproject Software Engineering has been passed. For full-time (1 year) students: All courses of the first semester and the first block of the second semester have been passed. The course Preparation Masterproject Software Engineering also has been passed. Time period(s)  College/graduate Graduate School of Informatics Lecturer(s) Is part of Carry out the research as proposed by the plan you made in the preparation phase. A lecturer (tutor) will be available for weekly feedback and discussion. Part time students will need to free time to work at least two month full time on their research. In order to start the Master’s project you need to have approval from a lecturer (tutor) on your project plan and related literature survey. Registration is NOT required but will be done by the Servicedesk of the ESC after the completion of the Master Project. The Master’s project consists of a software engineering-themed research assignment (an internship) at either a company or a research institution. Blackboard Scientific literature Course catalogue number 5364MAS18Y Credits 18 EC Language of instruction English Entry requirements For part-time (2 year) students: all other courses in the program have been passed, and the course Preparation Masterproject Software Engineering has been passed. For full-time (1 year) students: All courses of the first semester and the first block of the second semester have been passed. The course Preparation Masterproject Software Engineering also has been passed. Time period(s) Sem. 1Sem. 2 Sem. 1 Sem. 2   Sem. 1 Sem. 2   College/graduate Graduate School of Informatics Lecturer(s) dr. M. Bruntinkdrs. H.L. Dekkersprof. dr. D.J.N. van Eijckprof.dr. P. Klintdr. T. van der Stormdr. V.V. Zaytsev (co-ordinator) Is part of Master's Software Engineering Add course to planner Sem. 1 Sem. 2   dr. M. Bruntink drs. H.L. Dekkers prof. dr. D.J.N. van Eijck prof.dr. P. Klint dr. T. van der Storm dr. V.V. Zaytsev (co-ordinator) Master's Software Engineering Acquiring the ability to do research by designing, executing and reporting on a project in the area of software engineering research, Adding knowledge or gathering new evidence in the field of software engineering. Quality of the work as reported on in the thesis, Quality of the presentation given during the defense session."
Software Engineering,
Software Evolution,"Course catalogue number 5364SOEV6Y Credits 6 EC Language of instruction English Time period(s)  See also College/graduate Graduate School of Informatics Lecturer(s) Is part of Exit qualification: “The graduate masters the methods and techniques needed to analyze an existing software system and to enable it to evolve given changing requirements.” Our objectives are three-fold: The course ties in closely with paper writing sessions where the objectives are to learn from academic literature, to develop curiosity, and to improve argumentation and writing skills. This course is designed around lab sessions in which we study real and large (open-source) software systems, written in languages like C, Java, PHP or Ruby. We use Rascal -a programming language workbench, or meta programming language- to apply and build software metrics, software analyses, software visualisations and (if time permits) software transformations. See http://www.rascal-mpl.org. The student is supported with introductory courses and interactive lab sessions while learning this new language in the beginning. The course is supported by a series of lectures on the theory of software maintenance and evolution, guest lecturers from field experts, and a guided study of a number of research papers about maintenance, reverse engineering, reengineering and renovation. Example topics are clone detection, mining software repositories and refactoring. The format is focused on practical skills via the lab exercises, such as exploring source code and building tools, and academic skills via the paper sessions. Every week we start with a two hour lecture on the theory of software evolution, which is required to understand the material covered in the lab exercises. The rest of the day and the following day are lab hours. You also need two hours time every other week to prepare for the bi-weekly two-hour paper sessions. In this course we use the experimental programming language Rascal, which is (beta) open-source software and new to most students. On top of that we dive into many new topics for the students. Therefore the lab time is designed to be an integral and interactive part of the teaching, where the lecturer and the students are both present. This course typically uses the following assessments, that will be detailed at the start of the course: The grade weights are indicative and will be detailed at the start of the course. Course catalogue number 5364SOEV6Y Credits 6 EC Language of instruction English Time period(s) Sem. 1Sem. 2See also Sem. 1 Sem. 2   Sem. 1 Sem. 2   College/graduate Graduate School of Informatics Lecturer(s) dr. M. Bruntinkdr. V.V. Zaytsev (co-ordinator) Is part of Master's Software Engineering Add course to planner Sem. 1 Sem. 2   Registration is required viahttps://www.sis.uva.nlbefore the start of the semester. Please visit the website of your programme throughhttp://student.uva.nland check the A-Z list ’Course and Exam Registration’ for more information. dr. M. Bruntink dr. V.V. Zaytsev (co-ordinator) Master's Software Engineering The first objective is to acquire an understanding and appreciation of the challenges posed by software maintenance and software evolution. The second objective is to learn about quality of software and source code and how it affects software maintenance and evolution. The final objective is to be able to select and also construct software analysis and software transformation tools to help obtain insight in software quality and to help improve software quality. Advanced programming skills in several programming languages. Knowledge of compiler construction (parsing, ASTs, basic code analysis, etc.). Good (academic) English reading and writing skills. http://www.rascal-mpl.org:http://www.rascal-mpl.org reader consisting of selected papers on software evolution potentially other (academic) sources online test to assess basic skills practical lab assignments, assessed by demonstration and oral exam (2/3 of final grade) writing exercise(s): essay and/or annotated bilbiography (1/3 final grade)"
